{"contract_version":"candidate-election-0.1","generated_at":"2026-08-25T00:00:00-06:00","jurisdiction":{"identity_status":"RESOLVED","jurisdiction_id":"jur-wb020-9feaa3c8670a5121c18c71b2e002585395b1aa2c6f27176bca15200a06969672","jurisdiction_kind":"Municipality","jurisdiction_type":"Municipality","official_name":"Cross Timber","source_jurisdiction_key":"17917","state_code":"TX"},"package_id":"tx-17917-candidate-election-2026","package_type":"candidate_election","provenance":{"context_evidence":[{"authority_level":"OFFICIAL_PRIMARY","confidence":"HIGH","evidence_status":"ACTIVE","observed_at":"2024-11-30","retrieved_at":"2026-08-20","source_evidence_id":"ev-wb020-b0949f2abc0789b87a549c20c19d09fbeaa9ff42c7dd2861f050d9cc1be4e9f1","source_field":"relationship:jurisdiction_division:governs","source_record_id":"sr-wb020-414f235470fec021f7fccd7c1095ee232778ffb9e9ea582bb2018710e07b2241","source_type":"OFFICIAL_WEB","source_url":"https://tigerweb.geo.census.gov/tigerwebmain/Files/acs25/tigerweb_acs25_incplace_2025_bas25_tx.html","source_url_normalized":"https://tigerweb.geo.census.gov/tigerwebmain/Files/acs25/tigerweb_acs25_incplace_2025_bas25_tx.html"}],"context_source_record_refs":[{"raw_row_sha256":"aefb2d5ec4c1747a34d1a086222002ff0274b361ff9ca8e5837080fc0ecd7226","record_type":"Source","row_disposition":"SUPPORTING_EVIDENCE","source_native_id":"TX-BAS25-INCPLACE-STATEWIDE","source_record_id":"sr-wb020-414f235470fec021f7fccd7c1095ee232778ffb9e9ea582bb2018710e07b2241","workbook_id":"WB-020"}],"evidence_links":[{"assertion_kind":"RELATIONSHIP","assertion_name":"governs","evidence_link_id":"el-wb020-9feaa3c8670a5121c18c71b2e002585395b1aa2c6f27176bca15200a06969672","source_evidence_id":"ev-wb020-b0949f2abc0789b87a549c20c19d09fbeaa9ff42c7dd2861f050d9cc1be4e9f1","target_entity":"Jurisdiction_Division","target_id":"jd-wb020-9feaa3c8670a5121c18c71b2e002585395b1aa2c6f27176bca15200a06969672"},{"assertion_kind":"RELATIONSHIP","assertion_name":"represents","evidence_link_id":"el-wb020-b829923447ca163ffb154a44c52dde47338b3229810c4b553ee14d92e6f89fcb","source_evidence_id":"ev-wb020-c753e76fd53171ec1f98ce88edbca0fae69f9643371dc69795d3c329fc5d10f0","target_entity":"Office_Division","target_id":"od-wb020-7f9d989d21bd8aba013fd62e6758303c6ffc944b0a863615095ba2ac182308fc"},{"assertion_kind":"IDENTITY","assertion_name":"standing_office","evidence_link_id":"el-wb020-d43b469ce7dd0f829d4b53f527ab48afdb103f74533bf59cae4176a6cbe21d7b","source_evidence_id":"ev-wb020-c753e76fd53171ec1f98ce88edbca0fae69f9643371dc69795d3c329fc5d10f0","target_entity":"Office","target_id":"off-wb020-3571ee1affd2a4e8c4a0c77e9fe54292298d0770774551013a40c88e7f4b7066"}],"source_evidence":[{"authority_level":"OFFICIAL_PRIMARY","confidence":"HIGH","evidence_status":"ACTIVE","observed_at":"2026-08-25","retrieved_at":"2026-08-25","source_evidence_id":"ev-wb020-c753e76fd53171ec1f98ce88edbca0fae69f9643371dc69795d3c329fc5d10f0","source_field":"candidate_and_office","source_record_id":"sr-wb020-c753e76fd53171ec1f98ce88edbca0fae69f9643371dc69795d3c329fc5d10f0","source_type":"OFFICIAL_WEB","source_url":"https://crosstimbertx.com/elections/","source_url_normalized":"https://crosstimbertx.com/elections/"}],"source_record_refs":[{"raw_row_sha256":"e41406ac01f70260a102da86a0a21a4cb026c7ca28a3a98de61b3029e175ed8d","record_type":"Candidate","row_disposition":"CANDIDACY","source_native_id":"CROSS-TIMBER-2026-CITY-COUNCIL-ALDERMAN-KIMBERLI-BROOME-1","source_record_id":"sr-wb020-c753e76fd53171ec1f98ce88edbca0fae69f9643371dc69795d3c329fc5d10f0","workbook_id":"WB-020"}]},"publication_status":"STAGED_NOT_PUBLISHED","qa":{"blocking_gap_count":0,"complete_eligible":true,"deterministic":true,"false_complete":false,"parity_ok":true,"parity_status":"3.00 – Pass","provenance_complete":true,"qa_fail_count":0,"ready_for_done":true,"release_disposition":"COMPLETE_ROSTER","sensitivity_filter_pass":true,"workflow_status":"9.00 – Complete"},"reconciliation":{"canonical_candidacy_total":1,"excluded_source_records":[],"normalized_total":1,"public_source_record_ref_count":1,"qa_ready_total":1,"record_type_counts":{"Candidate":1,"Gap":0,"Retired":0,"Structure":0},"source_scope_total":1},"records":{"candidacies":[{"candidacy_id":"cand-wb020-c753e76fd53171ec1f98ce88edbca0fae69f9643371dc69795d3c329fc5d10f0","candidacy_status":"Filed","contest_id":"con-wb020-e858f0bab998593075fc436a956812b77dca6f1a878cbec0af2aff53e78ce5ff","incumbent_status":"Unknown","person_id":"per-wb020-c753e76fd53171ec1f98ce88edbca0fae69f9643371dc69795d3c329fc5d10f0","primary_source_record_id":"sr-wb020-c753e76fd53171ec1f98ce88edbca0fae69f9643371dc69795d3c329fc5d10f0"}],"contact_points":[],"contests":[{"contest_id":"con-wb020-e858f0bab998593075fc436a956812b77dca6f1a878cbec0af2aff53e78ce5ff","contest_label":"City Council - At-Large | 2026-05-02 General","contest_status":"canceled","election_id":"elec-wb020-4078e8e97979afa656b906eaf1a0e77fcb5781bf04ac283f00bd455b29cb2ea8","expected_seats":"3","office_id":"off-wb020-3571ee1affd2a4e8c4a0c77e9fe54292298d0770774551013a40c88e7f4b7066"}],"divisions":[{"division_id":"div-wb020-9feaa3c8670a5121c18c71b2e002585395b1aa2c6f27176bca15200a06969672","division_kind":"Municipality","division_name":"Cross Timber","division_state_name":"Texas","source_county_names":"Johnson","state_code":"TX"}],"elections":[{"administering_jurisdiction_id":"jur-wb020-9feaa3c8670a5121c18c71b2e002585395b1aa2c6f27176bca15200a06969672","election_date":"2026-05-02","election_id":"elec-wb020-4078e8e97979afa656b906eaf1a0e77fcb5781bf04ac283f00bd455b29cb2ea8","election_status":"canceled","election_type":"General","source_record_id":"sr-wb020-c753e76fd53171ec1f98ce88edbca0fae69f9643371dc69795d3c329fc5d10f0"}],"external_identifiers":[],"jurisdiction_divisions":[{"division_id":"div-wb020-9feaa3c8670a5121c18c71b2e002585395b1aa2c6f27176bca15200a06969672","jurisdiction_division_id":"jd-wb020-9feaa3c8670a5121c18c71b2e002585395b1aa2c6f27176bca15200a06969672","jurisdiction_id":"jur-wb020-9feaa3c8670a5121c18c71b2e002585395b1aa2c6f27176bca15200a06969672","relationship_type":"governs","source_evidence_id":"ev-wb020-b0949f2abc0789b87a549c20c19d09fbeaa9ff42c7dd2861f050d9cc1be4e9f1"}],"office_divisions":[{"division_id":"div-wb020-9feaa3c8670a5121c18c71b2e002585395b1aa2c6f27176bca15200a06969672","office_division_id":"od-wb020-7f9d989d21bd8aba013fd62e6758303c6ffc944b0a863615095ba2ac182308fc","office_id":"off-wb020-3571ee1affd2a4e8c4a0c77e9fe54292298d0770774551013a40c88e7f4b7066","relationship_type":"at_large_for","source_evidence_id":"ev-wb020-c753e76fd53171ec1f98ce88edbca0fae69f9643371dc69795d3c329fc5d10f0"}],"offices":[{"identity_status":"RESOLVED","jurisdiction_id":"jur-wb020-9feaa3c8670a5121c18c71b2e002585395b1aa2c6f27176bca15200a06969672","office_district_name":"Multi-seat","office_district_type":"At-Large","office_id":"off-wb020-3571ee1affd2a4e8c4a0c77e9fe54292298d0770774551013a40c88e7f4b7066","office_name":"City Council","office_status":"unknown"}],"people":[{"identity_resolution_status":"PROVISIONAL","person_full_name":"Kimberli Broome","person_id":"per-wb020-c753e76fd53171ec1f98ce88edbca0fae69f9643371dc69795d3c329fc5d10f0","provisional_source_record_id":"sr-wb020-c753e76fd53171ec1f98ce88edbca0fae69f9643371dc69795d3c329fc5d10f0"}]},"release_id":"tx-candidate-election-2026-001","source_authority":{"freshness_date":"2026-08-25","spreadsheet_id":"1xG1J2fliSTOHoohhDGbsCM4OYUJq0ArEFFLlNYWA6D8","workbook_id":"WB-020","workbook_title":"TX_ELECTIONS_Data_C6"},"warnings":[]}
